{
  "$schema": "https://json-schema.org/draft/2020-12/schema",
  "$id": "https://qory.dev/contracts/forager/v1/configuration.schema.json",
  "title": "Configuration",
  "description": "What a server returns for a signed GET of /.well-known/qory-configuration, per access key: the access key's node, and for a node's or a node pool's key its workspace, where Forager posts its events, where a run registers, whether the access key is allowed stored secrets, and the server's keys. A section Forager does not recognise is ignored; an added section is a new revision of this contract.",
  "type": "object",
  "additionalProperties": true,
  "required": ["version", "node_id", "events", "run", "apiary_public_key"],
  "if": {"properties": {"node_id": {"pattern": "^ng_"}}},
  "then": {"properties": {"workspaces": false}},
  "else": {"required": ["workspaces"], "properties": {"workspaces": {"maxItems": 1}}},
  "properties": {
    "version": {
      "description": "The document format. Forager refuses a version it does not read.",
      "const": 1
    },
    "node_id": {
      "description": "The id of the access key's node, nd_, node pool, np_, or gateway, ng_, followed by 16 lower-case Crockford base32 characters. Listed for every verified access key, for display; the ng_ prefix alone says the key is a gateway's.",
      "type": "string",
      "pattern": "^n[dpg]_[0-9a-hjkmnp-tv-z]{16}$"
    },
    "workspaces": {
      "description": "The workspace ids, each ws_ followed by 16 lower-case Crockford base32 characters. For a node's or a node pool's key exactly one: the workspace the node or node pool belongs to. A gateway's key, node_id ng_, has none: a gateway is connected to the nodes and node pools whose choice resolves to it, and takes each run's workspace from the run's run key. A document of a node's or a node pool's key without workspaces or with more than one, or of a gateway's key with workspaces, is refused.",
      "type": "array",
      "minItems": 1,
      "uniqueItems": true,
      "items": {
        "type": "string",
        "pattern": "^ws_[0-9a-hjkmnp-tv-z]{16}$"
      }
    },
    "events": {
      "description": "Where the events go and which.",
      "type": "object",
      "additionalProperties": false,
      "required": ["url", "types"],
      "properties": {
        "url": {
          "description": "The endpoint every batch is posted to. https, or http to a loopback address only.",
          "type": "string",
          "format": "uri",
          "pattern": "^(https://[^/?#@\\s]+|http://(localhost|127\\.0\\.0\\.1|\\[::1\\])(:[0-9]+)?)(/[^\\s]*)?$"
        },
        "types": {
          "description": "The event types the server wants, by full type name, or * for every type.",
          "type": "array",
          "uniqueItems": true,
          "minItems": 1,
          "items": {
            "type": "string",
            "pattern": "^(\\*|dev\\.qory\\.[a-z_]+(\\.[a-z_]+)*)$"
          }
        }
      }
    },
    "run": {
      "description": "The run endpoint, which every server has. A run registers with a signed POST to url, whose body is a run-registration.schema.json document and whose answer is the run's run configuration; a reload fetches the run configuration again with a signed GET of url followed by a slash and the run's id. A document without run is refused.",
      "type": "object",
      "additionalProperties": false,
      "required": ["url"],
      "properties": {
        "url": {
          "description": "The run endpoint. https, or http to a loopback address only, with no query, no fragment and no trailing slash: a reload appends a slash and the run's id to it.",
          "type": "string",
          "format": "uri",
          "pattern": "^(https://[^/?#@\\s]+|http://(localhost|127\\.0\\.0\\.1|\\[::1\\])(:[0-9]+)?)(/[^\\s?#]*[^\\s?#/])?$"
        }
      }
    },
    "secrets": {
      "description": "Present for an access key allowed stored secrets. A server that lists it requires a wall for every run against it.",
      "type": "object",
      "additionalProperties": false,
      "required": ["url"],
      "properties": {
        "url": {
          "description": "https, or http to a loopback address only.",
          "type": "string",
          "format": "uri",
          "pattern": "^(https://[^/?#@\\s]+|http://(localhost|127\\.0\\.0\\.1|\\[::1\\])(:[0-9]+)?)(/[^\\s]*)?$"
        }
      }
    },
    "apiary_public_key": {
      "description": "The server's Ed25519 public keys, the current one and during a rotation the next one after it, listed for every verified access key for information: Forager verifies under its pin alone.",
      "type": "array",
      "minItems": 1,
      "maxItems": 2,
      "uniqueItems": true,
      "items": {
        "type": "object",
        "additionalProperties": false,
        "required": ["alg", "public_key"],
        "properties": {
          "alg": {"const": "ed25519"},
          "public_key": {"type": "string", "pattern": "^[A-Za-z0-9_-]{42}[AEIMQUYcgkosw048]$"}
        }
      }
    }
  }
}
