{
  "version": 1,
  "node_id": "np_f1xt0re000000000",
  "events": {
    "url": "https://qory.example/v1/events",
    "types": ["*"]
  },
  "run": {
    "url": "https://qory.example/v1/run-configuration"
  },
  "secrets": {
    "url": "https://qory.example/v1/secrets"
  },
  "apiary_public_key": [
    {"alg": "ed25519", "public_key": "rcFAEfgtHFbZVqpPnXPYhYNhpgYEhSXg0Ixjjcdd2Mc"},
    {"alg": "ed25519", "public_key": "C0eCPnEJXdWb54rCccV27zifh7ZFYasHz5pOvNAtIEE"}
  ]
}
