{
  "version": 1,
  "node_id": "ng_f1xt0re000000000",
  "events": {
    "url": "https://qory.example/v1/events",
    "types": ["*"]
  },
  "run": {
    "url": "https://qory.example/v1/runs"
  },
  "apiary_public_key": [
    {"alg": "ed25519", "public_key": "rcFAEfgtHFbZVqpPnXPYhYNhpgYEhSXg0Ixjjcdd2Mc"}
  ]
}
